{
    "keyword": "expat health insurance",
    "search_volume": 1300,
    "difficulty": 18,
    "cpc": 19.35,
    "trend": [
        {
            "year": 2026,
            "month": 7,
            "search_volume": 1300
        },
        {
            "year": 2026,
            "month": 6,
            "search_volume": 720
        },
        {
            "year": 2026,
            "month": 5,
            "search_volume": 1300
        },
        {
            "year": 2026,
            "month": 4,
            "search_volume": 1600
        },
        {
            "year": 2026,
            "month": 3,
            "search_volume": 1900
        },
        {
            "year": 2026,
            "month": 2,
            "search_volume": 1000
        },
        {
            "year": 2026,
            "month": 1,
            "search_volume": 880
        },
        {
            "year": 2025,
            "month": 12,
            "search_volume": 880
        },
        {
            "year": 2025,
            "month": 11,
            "search_volume": 1300
        },
        {
            "year": 2025,
            "month": 10,
            "search_volume": 1000
        },
        {
            "year": 2025,
            "month": 9,
            "search_volume": 2400
        },
        {
            "year": 2025,
            "month": 8,
            "search_volume": 1000
        }
    ],
    "language": "en",
    "country": "US"
}